<?xml version="1.0" encoding="UTF-8"?>
<tns:Pattern xmlns:tns="http://www.example.org/dirigent-pattern/"
	xmlns:xsi="http://www.w3.org/2001/XMLSchema-instance"
	xsi:schemaLocation="http://www.example.org/dirigent-pattern/ ../dirigent-pattern.xsd ">
	<Documentation>TODO</Documentation>

	<PatternStep ignoreErrors="true" name="Drop Stage Table" type="JDBCStatement">
		<Template><![CDATA[    
		DROP TABLE STG_${element.targetTable.name}
    ]]>
    </Template>
	</PatternStep>

	<PatternStep name="Create Stage Table" type="JDBCStatement">
		<Template><![CDATA[    
		CREATE TABLE STG_${element.targetTable.name}
		(
			${element.targetColumnList}
		)
		as
		${element.SQLQuery}
    ]]>
    </Template>
	</PatternStep>
	
	<PatternStep name="Merge" type="JDBCStatement">
		<Template><![CDATA[ 
		INSERT INTO ${element.targetTable.name}
		(
			${element.targetColumnList},
			${element.targetTable.alias}_KEY
    	)
	    	SELECT 
	    		${element.targetColumnList},
	    		${element.targetTable.alias}_SEQ.NEXTVAL
			FROM STG_${element.targetTable.name} stg
    ]]>
    </Template>
	</PatternStep>
</tns:Pattern>
