<?xml version="1.0" encoding="UTF-8"?>
<tns:Pattern xmlns:tns="http://www.example.org/dirigent-pattern/"
	xmlns:xsi="http://www.w3.org/2001/XMLSchema-instance"
	xsi:schemaLocation="http://www.example.org/dirigent-pattern/ ../dirigent-pattern.xsd"
	name="TRUNCATE_INSERT">
	<Documentation> Load target table using truncate insert pattern. 
	</Documentation>
	<Parameter name="truncateTargetTable" defaultValue="Yes">
		<Documentation>If Yes target table will be truncated before loading
			data.</Documentation>
	</Parameter>
	<PatternStep name="Truncate target table" type="JDBCStatement">
		<Template> DELETE FROM ${element.targetTable.fullName};</Template>
	</PatternStep>
	<PatternStep name="Load target table" type="JDBCStatement">
		<Template> INSERT INTO ${element.targetTable.fullName}
			(${element.targetColumnList}) ${element.SQLQuery};</Template>
	</PatternStep>
</tns:Pattern>