<?xml version="1.0" encoding="UTF-8"?>
<tns:Pattern name="" xmlns:tns="http://www.example.org/dirigent-pattern/"
	xmlns:xsi="http://www.w3.org/2001/XMLSchema-instance"
	xsi:schemaLocation="http://www.example.org/dirigent-pattern/ ../dirigent-pattern.xsd ">
	<Documentation>Documentation</Documentation>
	<PatternStep ignoreErrors="false" name="DropObjects" type="File">
		<Parameter name="fileName" value="data-model/L2/${element.name}.drop.sql" />
		<Parameter name="mode" value="overwrite" />
		<Template><![CDATA[    
    	/*Drop script for dimension ${element.name}*/

    	/*Drop table.*/
    	DROP TABLE ${element.name};

    	/*Drop sequence.*/
		DROP SEQUENCE ${element.alias}_SEQ;		
    ]]>
    </Template>
	</PatternStep>
	<PatternStep ignoreErrors="false" name="CreateObjects"
		type="File">
		<Parameter name="fileName" value="data-model/L2/${element.name}.create.sql" />
		<Parameter name="mode" value="overwrite" />
		<Template><![CDATA[    
    	/*Create script for dimension ${element.name}*/  
    	CREATE TABLE ${element.name} (
    		${element.alias}_KEY NUMBER(38) PRIMARY KEY,
    		#foreach($column in $element.columns)${column.name} ${column.dataType},
    		#end		
			
			${element.alias}_VALID_FROM_DATETIME DATE,
			${element.alias}_VALID_TO_DATETIME DATE,
			${element.alias}_CURRENT_FLAG CHAR(1),
			${element.alias}_UPDATED_DATETIME DATE
    	);

		/*Create sequence for generation of surrogate key values.*/   
    	CREATE SEQUENCE ${element.alias}_SEQ;
    ]]>
    </Template>
	</PatternStep>
</tns:Pattern>
